{
  "version": 1,
  "id": "main",
  "width": 1080,
  "height": 1920,
  "fps": 30,
  "duration": 4.0,
  "background": "#141210",
  "_idSeq": 3,
  "fonts": [
    {
      "family": "Fraunces",
      "weight": "900",
      "src": "assets/fonts/fraunces-900.ttf"
    },
    {
      "family": "Inter",
      "weight": "500",
      "src": "assets/fonts/inter-500.ttf"
    }
  ],
  "assets": {
    "bg": {
      "kind": "image",
      "path": "assets/bg.png"
    }
  },
  "tracks": [
    {
      "id": "video",
      "kind": "visual",
      "clips": [
        {
          "id": "clip_000000",
          "type": "image",
          "start": 0,
          "length": 4.0,
          "source": "bg"
        }
      ]
    },
    {
      "id": "overlay",
      "kind": "visual",
      "clips": [
        {
          "id": "clip_000001",
          "type": "text",
          "start": 0.3,
          "length": 3.7,
          "text": "Xotion",
          "position": {
            "x": 540,
            "y": 820,
            "anchor": "center"
          },
          "style": {
            "fontFamily": "Fraunces",
            "fontSize": 210,
            "fontWeight": "900",
            "color": "#faf8f3"
          },
          "transform": {
            "opacity": 0,
            "scale": 0.9
          },
          "keyframes": [
            {
              "at": 0,
              "dur": 0.8,
              "ease": "power3.out",
              "props": {
                "opacity": 1,
                "scale": 1
              }
            }
          ]
        },
        {
          "id": "clip_000002",
          "type": "text",
          "start": 0.7,
          "length": 3.3,
          "text": "the editor for AI agents",
          "position": {
            "x": 540,
            "y": 1010,
            "anchor": "center"
          },
          "style": {
            "fontFamily": "Inter",
            "fontSize": 58,
            "fontWeight": "500",
            "color": "#e0451f"
          },
          "transform": {
            "opacity": 0,
            "y": 26
          },
          "keyframes": [
            {
              "at": 0,
              "dur": 0.7,
              "ease": "power3.out",
              "props": {
                "opacity": 1,
                "y": 0
              }
            }
          ]
        }
      ]
    },
    {
      "id": "audio",
      "kind": "audio",
      "clips": []
    }
  ]
}